title,url,author,time,content,sentiment_label
轟內閣改組「換湯不換藥」藍委呼籲賴政府：若未大破大立全民皆輸,https://tw.news.yahoo.com/%E8%BD%9F%E5%85%A7%E9%96%A3%E6%94%B9%E7%B5%84-%E6%8F%9B%E6%B9%AF%E4%B8%8D%E6%8F%9B%E8%97%A5-%E8%97%8D%E5%A7%94%E5%91%BC%E7%B1%B2%E8%B3%B4%E6%94%BF%E5%BA%9C-%E8%8B%A5%E6%9C%AA%E5%A4%A7%E7%A0%B4%E5%A4%A7%E7%AB%8B%E5%85%A8%E6%B0%91%E7%9A%86%E8%BC%B8-074359379.html,林兪彤,2025/08/26 15:43,全台大罷免最終以32:0完封，綠營內閣展開改組、外界檢討聲浪不斷。對此，挺過大罷免的國民黨立委賴士葆也指出，「政壇喜愛猜猜樂」，現在行的猜猜樂是內閣改組誰會下台、誰會上台、誰被請辭等，以為互換位置就可以回應最新的民意，其實只是換湯不換藥。賴士葆也認為，這一年多的重大政策，就是抗中保台以及非核家園，「完全忽略6成主流民眾的意見」，若政府沒有大破大立改革，全民都是輸家。賴士葆今日於臉書發文表示，政壇喜愛猜猜樂，大罷免的過程中每天談話性節目，或是新聞媒體訪問政界人士，就是讓來賓猜會罷掉幾席，「強行形塑藍委會被罷免的必然與必需，隱匿、模糊了應該檢討大罷免的正當性與合理性。」賴士葆續指，現在正在進行的猜猜樂是內閣改組誰會下台、誰會上台、誰被請辭、內閣會小改組或是大改組，「好像大風吹幾個閣員下台或是互換位子就可以回應最新的民意，同時解決沸騰的民怨」。但殊不知，一個站在人民對立面的政府，面對國事不自省、不悔過，民調只會繼續往下掉，換幾個閣員絕對無法解決問題，根本換湯不換藥。賴士葆也說，自己在罷免過程中接收到最多基層的民意，都是表達最想要罷免的對象是總統賴清德，但是因為罷免總統的門檻高，雙少數當選的賴清德，其實原本應該更加努力使自己成為全民總統，而不是同溫層的綠營總統。最後，賴士葆強調，然而這一年多的重大政策，就是抗中保台以及非核家園，「這樣是完全忽略6成主流民眾的意見」，要弭平民怨，沒有大破大立大改革，政府繼續沉淪，全民都是輸家。,負向
男不滿21歲愛女閃婚70歲老翁　女婿不肯離婚！他砸錢買兇殺人,https://tw.news.yahoo.com/%E7%94%B7%E4%B8%8D%E6%BB%BF21%E6%AD%B2%E6%84%9B%E5%A5%B3%E9%96%83%E5%A9%9A70%E6%AD%B2%E8%80%81%E7%BF%81-%E5%A5%B3%E5%A9%BF%E4%B8%8D%E8%82%AF%E9%9B%A2%E5%A9%9A-%E4%BB%96%E7%A0%B8%E9%8C%A2%E8%B2%B7%E5%85%87%E6%AE%BA%E4%BA%BA-074008040.html,周刊王CTWANT |網編組,2025/08/26 15:40,大陸一名男子不滿21歲的女兒與70歲老翁結婚，女婿不肯離婚竟決定花錢買兇殺害他。（示意圖非當事人／unsplash）情侶或夫妻年齡差距太大，往往不被樂見，有的甚至會遭到家人反對。大陸江西一名男子阿華（文中人名皆化名）發現21歲的女兒小美偷偷與70歲男友老王登記結婚，他知道後非常不滿，女婿也不肯離婚，他一氣之下花錢買兇，把女婿殺害。阿華與4名兇手都被逮，近日其中一人依法被判無期徒刑。根據陸媒《瀟湘晨報》報導，江西一名男子阿華在1994年12月發現當時21歲的女兒小美，突然閃婚70歲的老王，兩人瞞著他完成登記，讓他產生強烈不滿。在1995年4月7日阿華遇到外甥阿豪，向他訴苦自己反對小美與老王的婚事，要求女婿離婚但他不肯。阿華因此萌生殺機，他願意給阿豪人民幣1萬元（約新台幣4.3萬元）請他找人殺害女婿老王，阿豪聽完之後表示同意。阿豪拿錢後，找來阿凱等3人共同計劃如何謀殺老王，同年4月9日下午，阿豪連同3同夥到老王住處附近埋伏，尾隨他一段時間後，當晚8時闖入老王住處，4人先把老王推倒在地，再用刀朝他亂砍，導致老王當場死亡。案發後其中一名嫌犯阿凱為了躲避追捕，改名換姓潛逃到廣東，直到2023年10月20日下午才被逮捕歸案。阿華被逮後才說，他不同意小美與老王的婚事，因為害他抬不起頭。法院判定阿凱在阿豪邀請下，4人持刀故意殺害老王致死，其行為已構成蓄意殺人，依法皆判處不同程度的刑期；一審時阿凱被判處無期徒刑，他不服上訴後，近期二審法院裁定維持原判。原始連結看更多 CTWANT 文章4面相易晚婚 命理師：有這特徵「想不出為何要有另一半」11歲女童懷孕全家沒人知 無預警在家生小孩！失職父母慘了幼稚園弟弟送急診哭得滿身汗！他靠「2句話」緩解就醫恐懼,中性
美股承壓，投資人寄望輝達財報「異常強勁」，扮科技股「救火隊」,https://tw.news.yahoo.com/%E7%BE%8E%E8%82%A1%E6%89%BF%E5%A3%93-%E6%8A%95%E8%B3%87%E4%BA%BA%E5%AF%84%E6%9C%9B%E8%BC%9D%E9%81%94%E8%B2%A1%E5%A0%B1-%E7%95%B0%E5%B8%B8%E5%BC%B7%E5%8B%81-%E6%89%AE%E7%A7%91%E6%8A%80%E8%82%A1-%E6%95%91%E7%81%AB%E9%9A%8A-080703439.html,財訊快報,2025/08/26 16:07,【財訊快報／陳孟朔】美股在降息預期熱潮退去後再度承壓，標普500指數週一連續下挫，過去七個交易日中只有一天收紅，市場焦點轉向企業財報能否提振信心。投資人寄望輝達(美股代碼NVDA)8月27日盤後公布的財報能展現「格外強勁」的表現，為疲弱的科技類股注入動能。標普500指數週一下跌0.43%，那斯達克100指數跌0.22%。儘管大盤走弱，但部分大型科技股上漲抵銷部分跌幅，輝達週一股價逆勢收高1%，成了道瓊工業指數成份股最大贏家。分析師指出，占標普權重達8%的輝達的表現對整體市場具舉足輕重的影響，若能超預期將有望重燃資金流入科技類股。Vital Knowledge創辦人Crisafulli直言，輝達需要交出「異常強勁」的財報，才能化解市場對AI投資回報的疑慮，進一步帶動資金回流。隨著AI成為過去幾年推動美股的重要主題，輝達被視為科技類股行情能否延續的風向標。KeyBanc在報告中預估，市場普遍預期輝達第三季營收約459.2億美元，每股盈餘估為1.01美元，若將中國業務納入，本可再增添20億至30億美元收入。該行強調，GPU供應及伺服器機架產能正持續改善，全年GB200機架出貨量有望達到3萬架，高於此前預估的2.5萬架。除輝達外，戴爾科技與Marvell本週也將相繼發布財報，將共同構成投資人檢驗AI投資熱潮可否延續的關鍵。分析師認為，若輝達交出亮眼財報，將有望帶動科技類股重拾升勢，進而穩定大盤。然而，若數據偏弱或前景指引保守，科技類股恐迎來「二次探底」，標普500和納斯達克等主要指數將難逃調整壓力。,中性
她與姐妹共同持有房子...卻無法享低自住稅率 財稅局來解答,https://tw.news.yahoo.com/%E5%A5%B9%E8%88%87%E5%A7%90%E5%A6%B9%E5%85%B1%E5%90%8C%E6%8C%81%E6%9C%89%E6%88%BF%E5%AD%90%E5%8D%BB%E7%84%A1%E6%B3%95%E4%BA%AB%E4%BD%8E%E8%87%AA%E4%BD%8F%E7%A8%85%E7%8E%87-%E8%B2%A1%E7%A8%85%E5%B1%80%E4%BE%86%E8%A7%A3%E7%AD%94-080650603.html,馮萱榕｜Yahoo財經特派記者,2025/08/26 16:07,民眾陳小姐與姐妹共同持有一間房屋，因陳小姐居住外地，且戶籍不在該共有房屋，應如何適用自住稅率？屏東縣政府財稅局表示，申請自住稅率需符合兩大要件。延伸閱讀：兒賣繼承土地險被課45%重稅！國稅局曝1關鍵「稅率大打折」房屋如屬多人共有，不論是「分別共有」還是「公同共有」，各共有人皆依持分比例享有使用與收益權。圖／Getty Images屏東縣政府財稅局說明，房屋如屬多人共有，不論是「分別共有」還是「公同共有」，各共有人皆依持分比例享有使用與收益權。房屋稅課徵主要依實際使用情況判斷，若僅其中一名共有人符合自住要件，則僅能就其持分部分適用自住稅率；其他不符合條件的共有人，例如未實際居住、未辦理戶籍登記，或名下自住房屋已超過三戶，則無法享有此優惠。以陳小姐為例，由於她並未將戶籍設於該房屋，也未實際居住，因此無法享有自住稅率；相對地，若她的姐妹符合相關規定，則該姐妹的持分部分仍可享有較低稅率。依規定，申請自住稅率需符合「實際居住」並完成「戶籍登記」兩大要件。財稅局提醒，若房屋已符合條件，納稅人務必在房屋稅開徵前40日完成申報，也就是每年的3月22日（如遇例假日則順延至次一工作日），才能自當期起適用較低稅率；若逾期申報，則需自下一期才會生效。財稅局補充，申報經核定後，只要房屋的使用情況未再變更，就不需要再次申報。但若忽略申報期限，可能導致整年度無法享有自住優惠，白白多繳稅款。,正向
元富期貨：加權指數上漲0.11%，類股健康輪動,https://tw.news.yahoo.com/%E5%85%83%E5%AF%8C%E6%9C%9F%E8%B2%A8-%E5%8A%A0%E6%AC%8A%E6%8C%87%E6%95%B8%E4%B8%8A%E6%BC%B20-11-%E9%A1%9E%E8%82%A1%E5%81%A5%E5%BA%B7%E8%BC%AA%E5%8B%95-080642470.html,財訊快報,2025/08/26 16:06,【財訊快報／編輯部】美股方面，市場對降息的樂觀預期消退，未能延續上週五在鮑爾演說帶動的強勁漲勢，並重新關注企業獲利前景，標普500指數週一失去動力，過去七個交易日中第六次下跌，道瓊工業指數則是從歷史新高回落。標普500十一大類股有9個下滑，其中民生必需品類股下挫1.62%跌幅居冠，其次是下跌1.44%的健康照護類股。台指方面，台指今日呈現開低走高格局，早盤一度大跌逾百點，所幸盤中在機器人、軍工等概念股輪漲助攻下，指數震盪回穩，類股表現方面，塑膠上漲1.57%今日最強，其他電子以1.14%緊隨其後，終場成交量5140.13億元，加權指數上漲27.72點、漲幅0.11%、收在24305.1點。綜合分析，台指今日回測十日均線有撐，守穩在所有均線之上，偏多架構不變。本週市場焦點在於美國利率前景，特別是即將發布的通膨數據，將影響聯準會的貨幣政策決策，除此之外，市場觀望晶片巨頭輝達財報，及其對未來AI展望。,正向
投縣圖書館學生志工召募 歡迎踴躍報名,https://tw.news.yahoo.com/%E6%8A%95%E7%B8%A3%E5%9C%96%E6%9B%B8%E9%A4%A8%E5%AD%B8%E7%94%9F%E5%BF%97%E5%B7%A5%E5%8F%AC%E5%8B%9F-%E6%AD%A1%E8%BF%8E%E8%B8%B4%E8%BA%8D%E5%A0%B1%E5%90%8D-080619830.html,【記者蔡榮宗／投縣報導】,2025/08/26 16:06,為了推廣書香滿南投的願景，南投縣政府文化局圖書館致力於閱讀氛圍的營造和閱讀活動辦理，常遭遇人力不足的困境。因此，文化局圖書館非常期待在學之學生加入志工行列，利用空閒的時間投入圖書館服務，共同協助圖書館提供優質的服務及辦理各項閱讀推廣活動，希望透過服務的過程增進自我了解和自我肯定，秉持「取之於社會，用之於社會」來回饋社會，為社會盡一份心力。今年度圖書館學生志工召募期間為一一四年九月二日起至一一五年一月三十一日止，歡迎國中以上之學生，對圖書館服務有熱忱者，填妥報名表繳交至文化局圖書館(南投市中興路669號)2樓服務台。召募簡章請至文化局網站(www.nthcc.gov.tw)下載或以電話洽詢圖書館廖小姐(電話2221619轉201)。,中性
投縣心理健康月系列活動 溫馨登場,https://tw.news.yahoo.com/%E6%8A%95%E7%B8%A3%E5%BF%83%E7%90%86%E5%81%A5%E5%BA%B7%E6%9C%88%E7%B3%BB%E5%88%97%E6%B4%BB%E5%8B%95-%E6%BA%AB%E9%A6%A8%E7%99%BB%E5%A0%B4-080500523.html,【記者蔡榮宗／投縣報導】,2025/08/26 16:05,「聊療心‧心投愛」 南投縣心理健康月系列活動溫馨登場。(圖：南投縣府衛生局提供)▲「聊療心‧心投愛」南投縣心理健康月系列活動溫馨登場。(圖：南投縣府衛生局提供)迎接九月十日「世界自殺防治日」及十月十日「世界心理健康日」，南投縣府衛生局積極推廣全民心理健康，規劃以「聊療心‧心投愛」為主題，結合「南投縣衛生局所七十五周年紀念」，舉辦系列「心理健康月」活動，歡迎民眾一同認識心理健康、學習自我照顧、放鬆心情。縣府衛生局指出，本年度心理健康月活動內容豐富，並結合縣府各局處一起推出知識、趣味與實作活動，八月二十九日至九月三十日「心靈小語大力量！秀出你的勵志slogan」，透過民眾分享心靈小語，並完成指定任務，即有機會獲得限量好禮，活動詳情請關注南投縣政府衛生局臉書粉絲專頁。九月二十一日上午十點到十二點，在南投縣政府文化局圖書館7樓電影放映廳，舉辦專題講座—「沒有門檻的幸福」，由導演楊士毅分享溫暖的真實故事。十月十八日在埔里鎮立綜合球場辦理「聊療心 心投愛﹣心旅行驛站」，有精彩的表演、摸彩及心理健康相關攤位，內容豐富。十月二十九日則於南投縣政府文化局演藝廳舉辦「聊療心 心投愛﹣75周年之心旅樂章」。更多活動詳情，請上南投縣政府衛生局網站連結或南投縣政府衛生局臉書粉絲專頁查詢。衛生局提醒表示，一旦感覺壓力過大、情緒低落時，不必獨自承擔，找不到人傾訴時，可善用各項心理資源，包括1925安心專線、1995協助專線及男性關懷專線0800-013-999。縣府為提供民眾安心求助的管道，於本縣十三鄉鎮衛生所及2處社區心理衛生中心(南投區及竹山區)設有免費心理諮商、遠距心理諮商及十五-四十五歲民眾免費3次心理諮商服務，諮商過程皆全程保密且受到法律與專業倫理的保護，確保民眾能放心表達內心想法。民眾可依所在地區就近選擇諮商地點，並自南投縣政府衛生局網站、南投健康樂活LINE@線上預約，或撥打南投區社區心理衛生中心049-2202662、竹山區社區心理衛生中心049-2631925，均有專人提供協助。,中性
楊謹華優雅引路  劉以豪體驗皮拉提斯道出初學者的心聲,https://tw.news.yahoo.com/%E6%A5%8A%E8%AC%B9%E8%8F%AF%E5%84%AA%E9%9B%85%E5%BC%95%E8%B7%AF-%E5%8A%89%E4%BB%A5%E8%B1%AA%E9%AB%94%E9%A9%97%E7%9A%AE%E6%8B%89%E6%8F%90%E6%96%AF%E9%81%93%E5%87%BA%E5%88%9D%E5%AD%B8%E8%80%85%E7%9A%84%E5%BF%83%E8%81%B2-080440838.html,張嘉誠,2025/08/26 16:04,【記者張嘉誠／綜合報導】知名器械皮拉提斯品牌「虎鐵」宣布，邀請戲劇女神楊謹華與男神劉以豪攜手成為雙代言人。兩人繼多年後再度同框，不僅掀起話題，更透過全新廣告詮釋品牌精神「不分階段、不設門檻」，鼓勵大眾從每一次練習中，找回與身體的連結。▲楊謹華與劉以豪攜手擔任虎鐵器械皮拉提斯品牌代言人。(圖/虎鐵器械皮拉提斯提供)全新形象廣告《劉以豪的第一堂皮拉提斯課》以自然真實的角度，紀錄劉以豪從初學到逐步掌握的過程。他在體驗時脫口而出：「這麼慢，卻這麼痠！」幽默反應道出許多初學者的心聲，也讓觀眾看見最真實的挑戰。▲劉以豪在廣告中飾演器械皮拉提斯初學者。(圖/虎鐵器械皮拉提斯提供)在廣告中，已經練習一年多的楊謹華親自指導，帶領劉以豪逐步學習呼吸與動作的協調。從一開始的笨拙，到慢慢找到節奏，兩人的互動呈現了虎鐵所強調的價值：在穩定中掌握控制，在控制中提升覺察。最後，劉以豪笑著感嘆：「我的身體，終於是我的了⋯」，象徵他重新奪回對身體的主導權。楊謹華在廣告裡，展現長期練習所累積的力量與自信，成為優雅的「引路人」；劉以豪則代表每個人從零開始的真實樣貌。這樣一動一靜的對比，不僅體現皮拉提斯的包容性，也讓人看見品牌核心理念：這不只是雕塑體態的技術，而是一種相信身體、與自己對話的方式。▲虎鐵器械皮拉提斯教室以自然光與留白設計，打造舒適練習氛圍。(圖/虎鐵器械皮拉提斯提供)虎鐵強調，器械皮拉提斯沒有門檻，不論新手或熟手，都能從中獲得力量與平衡。品牌希望透過兩位代言人的詮釋，讓更多人明白：只要用對方法，誰都能開始掌握自己的力量。,中性
法財長警告，若貝魯政府垮台，IMF或被迫干預法國經濟,https://tw.news.yahoo.com/%E6%B3%95%E8%B2%A1%E9%95%B7%E8%AD%A6%E5%91%8A-%E8%8B%A5%E8%B2%9D%E9%AD%AF%E6%94%BF%E5%BA%9C%E5%9E%AE%E5%8F%B0-imf%E6%88%96%E8%A2%AB%E8%BF%AB%E5%B9%B2%E9%A0%90%E6%B3%95%E5%9C%8B%E7%B6%93%E6%BF%9F-080414599.html,財訊快報,2025/08/26 16:04,【財訊快報／陳孟朔】路透報導，法國財政部長隆巴爾(Eric Lombard)週二示警，若總理貝魯(Francois Bayrou)的少數派政府在9月信任投票中失敗，國際貨幣基金(IMF)可能不得不介入法國經濟。貝魯政府因推動大幅削減預算的計劃，將於9月8日提交國會信任投票。然而，三大反對黨已表態不會支持，使其下台風險顯著升高。隆巴爾在接受《France Inter》電台專訪時坦言：「我們正處於一場激烈的戰鬥中。」他強調自己「絕不會對政府垮台坐以待斃」。對於外界認為若政府倒台，IMF可能介入法國財政的說法，隆巴爾承認：「這確實是一個眼前的風險。這是一個我們想要避免、也必須避免的風險，但我無法告訴你它不存在。」此番言論凸顯市場對法國政局的憂慮。與此同時，巴黎股市CAC40週二早盤大跌近2%，帶動歐洲股市同步走弱。投資人憂心，若信任投票未通過，不僅法國財政改革陷入停滯，還可能進一步動搖歐元區金融穩定。,中性
光聽Demo就落淚　范怡文新歌《美好時光》唱出人生感悟,https://tw.news.yahoo.com/%E5%85%89%E8%81%BDdemo%E5%B0%B1%E8%90%BD%E6%B7%9A-%E8%8C%83%E6%80%A1%E6%96%87%E6%96%B0%E6%AD%8C-%E7%BE%8E%E5%A5%BD%E6%99%82%E5%85%89-%E5%94%B1%E5%87%BA%E4%BA%BA%E7%94%9F%E6%84%9F%E6%82%9F-080316037.html,許 哲綱,2025/08/26 16:03,cnews207250826a06CNEWS匯流新聞網記者許哲綱、李衣綸／台北報導踏入歌壇40年，歌手范怡文在8月27日生日當天，推出全新單曲《美好時光》，由知名音樂人崔軾玄替她量身打造；崔軾玄對范怡文的樂觀開朗、豁達的精神深受感動，范怡文說，第一次聽到Demo時，當下淚流滿面，「雖然是平鋪直敘的歌詞，但講的都是我們每天的生活。」崔軾玄大讚范怡文狀態保持很好，除了平時勤健身，音準、各方面情感都表達的非常完美，是很自律的藝人，於是寫出《美好時光》這首適合她的正能量歌曲，表示「經歷人生的當下或許覺得痛苦，但回過頭來，會感謝生活中給予的一切。」范怡文坦言，做服裝20年，雖然結果不盡人意，但都是自己很喜歡的事，從歌手到做老闆，必須不斷進步，喜歡變化和挑戰，不然就等著別人超越，於是選在40週年時出新單曲，希望傳遞擁抱幸福的心情；范怡文表示，歌曲中最打動自己的一句是「讓青春永遠綻放，讓美麗都可以想像」，直言那是一種無法用言語形容的感動。如今透過《美好時光》，范怡文希望將這份溫暖傳遞給歌迷，她暖心表示，每個人都有屬於自己的美好時光，只要勇敢、健康、快樂的過生活，就能擁有屬於自己的幸福。照片來源：翰森娛樂《更多CNEWS匯流新聞網報導》認識心理健康拿好禮 南投心理健康月系列活動溫馨登場號召破300店採購創世中秋禮盒 永慶加盟四品牌高雄經管會送暖植物人家庭【文章轉載請註明出處】,正向
南投NEXT實驗室啟動 打造青年返鄉創生新動能,https://tw.news.yahoo.com/%E5%8D%97%E6%8A%95next%E5%AF%A6%E9%A9%97%E5%AE%A4%E5%95%9F%E5%8B%95-%E6%89%93%E9%80%A0%E9%9D%92%E5%B9%B4%E8%BF%94%E9%84%89%E5%89%B5%E7%94%9F%E6%96%B0%E5%8B%95%E8%83%BD-080247776.html,【記者蔡榮宗／投縣報導】,2025/08/26 16:02,南投NEXT實驗室啟動。(圖：青年發展所提供)▲南投NEXT實驗室啟動。(圖：青年發展所提供)為積極回應南投縣近期面臨的人口老化、青年外移與產業活力不足等挑戰，南投縣青年發展所啟動「南投NEXT實驗室」，以「輕踏土地慢學生活」為核心，培育青年成為推動地方創生與再造城鄉活力的關鍵動能，歡迎青年朋友踴躍上網報名參加。青年發展所表示，這次實驗室特別設計了五場系列課程，圍繞著「場域經營」、「地域文化」、「品牌經營」三大實用主題，透過系統性的引導，由淺入深的課程設計，從案例分享、手作互動到專案輔導，引導青年將學習成果轉化成可執行方案與實際行動。課程講師除邀請水里蛇窯、南投戲院、原夢觀光農園等在地單位，也包含具備專業經驗的跨領域講者，協助參與青年從成功案例中學習方法並歸納行動策略，從地方觀察、問題診斷到方案設計，陪伴青年進入「經驗共學、行動實踐」的歷程，同時透過青年資料庫建立與後續相關資源支持，逐步推動青年返鄉創生藍圖之實踐，為南投注入新的活力與希望。欲了解更多有關課程訊息，請上青年發展所官網(youth.nantou.gov.tw)及追蹤「南投好青年」臉書粉絲專頁掌握更多動態。,中性
投縣114年災害防救演習 8/27登場,https://tw.news.yahoo.com/%E6%8A%95%E7%B8%A3114%E5%B9%B4%E7%81%BD%E5%AE%B3%E9%98%B2%E6%95%91%E6%BC%94%E7%BF%92-8-27%E7%99%BB%E5%A0%B4-080119652.html,【記者蔡榮宗／投縣報導】,2025/08/26 16:01,南投縣政府將於八月廿七日十三時三十分至十五時分，假本縣南投市國道三號227.5K交流道下方空地(華陽路680號至浪漫情人橋間)，辦理「南投縣一一四年災害防救演習」，本次演習將運用最新科技-災防告警細胞廣播系統，透過電信業者向演習場地周邊半徑二公里內的手機廣播發送「疏散避難警報」測試訊息，讓民眾瞭解政府推動防災成果，並共同做好防災工作，以利於災害發生時可以即時獲得最新災害消息，採取應變措施，屆時收到此訊息民眾請勿驚慌。,正向
加薩醫院遭炸釀20死50傷　無國界醫生痛失攝影夥伴,https://tw.news.yahoo.com/%E5%8A%A0%E8%96%A9%E9%86%AB%E9%99%A2%E9%81%AD%E7%82%B8%E9%87%8020%E6%AD%BB50%E5%82%B7-%E7%84%A1%E5%9C%8B%E7%95%8C%E9%86%AB%E7%94%9F%E7%97%9B%E5%A4%B1%E6%94%9D%E5%BD%B1%E5%A4%A5%E4%BC%B4-080022953.html,李 映萱,2025/08/26 16:00,"CNEWS195250826a01CNEWS匯流新聞網記者李映萱／台北報導以色列昨（25）兩度轟炸加薩南部汗尤尼斯（Khan Younis）的納瑟醫院（Nasser Hospital），造成逾20人死亡、50人受傷，罹難者包括醫護人員、救援人員和記者等。曾多次與無國界醫生合作的攝影師Mariam Abu Dagga亦不幸殞命。無國界醫生（台灣）媒體推廣協理何鳳儀表示，對同事Mariam的離去深感痛心，並強烈譴責以色列當局對納瑟醫院的可怕襲擊。Mariam一面全力投入救援，一面被迫躲在實驗室中躲避攻擊。過去22個月，無國界醫生目睹醫療機構被夷為平地、醫護人員葬身瓦礫、記者遭壓制和噤聲。CNEWS195250826a02何鳳儀在去年5月至6月前往耶路撒冷擔任前線媒體推廣經理支援，曾於任務期間與Mariam共事。去年5月，無國界醫生剛重啟納瑟醫院的婦產和兒科部門，因在當地尚無媒體人力，而加薩處於封鎖狀態，遂委託Mariam協助採訪與影像工作。Mariam透過鏡頭記錄無國界醫生在極端條件下的救援工作，並協助收集前線人員和病患證詞，例如陪伴營養不良兒童看診的母親，以及冒險就醫的孕婦。如今加薩沒有任何一間醫院能全面運作，有逾九成受損或被摧毀。納瑟醫院是南部最後一間能部分運作的公立醫院，也是唯一擁有功能齊全的婦產科病房、新生兒與兒童加護病房的醫院。目前無國界醫生持續在加薩地區Al Helou與Nasser醫院提供醫療服務，並遠端支援一間基層醫療中心（Primary Health Care Corporation, PHCC）、3間診所。CNEWS195250826a03無國界醫生呼籲以色列當局允許充足援助進入加薩，保障200萬巴勒斯坦人的生存權，「以色列當局持續規避國際人道法約束，進行無差別的殺戮與種族滅絕行動，必須立即停止」。照片來源：CNEWS匯流新聞網資料照片《更多CNEWS匯流新聞網報導》以色列暴力升級 無國界醫生：約旦河西岸屯墾區巴勒斯坦人陷入恐慌無國界醫生站上街頭 呼籲援助不是武器、停止封鎖加薩【文章轉載請註明出處】",中性
