title,url,author,time,content,sentiment_label
兩岸青年72小時航拍挑戰   11部作品深圳紅立方亮相,https://tw.news.yahoo.com/%E5%85%A9%E5%B2%B8%E9%9D%92%E5%B9%B472%E5%B0%8F%E6%99%82%E8%88%AA%E6%8B%8D%E6%8C%91%E6%88%B0-11%E9%83%A8%E4%BD%9C%E5%93%81%E6%B7%B1%E5%9C%B3%E7%B4%85%E7%AB%8B%E6%96%B9%E4%BA%AE%E7%9B%B8-060935777.html,葉仁富,2025/08/26 15:32,《圖說》光影之間看見深圳，兩岸青年72小時航拍創作營作品。〈台北影音公會提供〉【記者羅伯特/深圳報導】歷經三天三夜的緊湊挑戰，61位來自海峽兩岸的青年影視創作者，以無人機鏡頭完成限時任務，11部原創短片今（26）日於深圳紅立方公共藝術與城市規劃館展映，為觀眾帶來一場結合科技與人文的視覺饗宴。展映後，作品將進入評選環節，並於明（27）日舉行頒獎典禮。台北市影音公會理事長陳仲祺在展映現場激動地表示，這次創作營開創了全新的競賽形式！在72小時的極限挑戰中，每個團隊都將航拍技術與劇情敘事完美融合，打造出令人驚艷的『航拍劇情片』新賽道。這群年輕人用三天時間將六大主題發揮得淋灕盡致，展現了驚人的創作潛能。他指出，此次創作營以「科創 × 人文」為核心，六大主題包括「龍崗智匯」、「人文賦」、「活力繪」、「新面貌」、「雙城密碼」、「有得住」，涵蓋無人物流、客家文化、創意街區、藝術館到兒童公園等十一個拍攝點。參與者必須在72小時內完成拍攝、剪輯與後製，挑戰創作極限。《圖說》兩岸青年72小時航拍創作營作品於紅立方展映。〈台北影音公會提供〉展映作品題材多樣：《無限發酵》從CC創意街區出發，講述舊廠房轉型的故事；《看見與被看見》探討藝術詮釋的多重視角；《寶安龍崗墟痕》則以老街與榕樹記錄城市變遷；《圳好友你》以閨蜜旅行視角結合科技便利與人情溫度，格外受到年輕觀眾共鳴。主辦方表示，這不僅是一場比賽，更讓深圳以全新影像語言被看見。展映後，作品將進入評選環節，並於明（27）日舉行頒獎典禮，揭曉「龍騰獎」及多個「優秀獎」。,中性
郭國文、林淑芬先後對老柯開砲 媒體人預言：這鍋不背不行了,https://tw.news.yahoo.com/%E9%83%AD%E5%9C%8B%E6%96%87-%E6%9E%97%E6%B7%91%E8%8A%AC%E5%85%88%E5%BE%8C%E5%B0%8D%E8%80%81%E6%9F%AF%E9%96%8B%E7%A0%B2-%E5%AA%92%E9%AB%94%E4%BA%BA%E9%A0%90%E8%A8%80-%E9%80%99%E9%8D%8B%E4%B8%8D%E8%83%8C%E4%B8%8D%E8%A1%8C%E4%BA%86-073228412.html,焦捷,2025/08/26 15:32,大罷免以32比0落幕，自稱發動此次行動的民進黨立院黨團總召柯建銘被視為頭號戰犯，同黨立委郭國文和林淑芬先後對其開炮。對此，資深媒體人謝寒冰直言，柯建銘現在被控欺上瞞下、造成敗局，這個鍋「不背不行了」。郭國文今（26）日表示，民進黨挫敗的檢討從來就不該對人，而是路線檢討，過去1年多來的路線就是離民心越來越遙遠，今天有報導寫出，自己前幾周在黨團大會上和柯建銘的衝突，「我必須強調，這來自於我對黨團路線的不滿與檢討」。他點出，過去許多法案，民進黨為了與藍白全面對抗，不只禁止自己立委提案，甚至連院版也禁止提，如大家過去都主張要修《財劃法》，但為了減少藍白修法的正當性，寧可說現行版本最好，也不願提院版。林淑芬今天也在臉書發文表示，這一屆的民進黨立法院黨團會議，幾乎是不被允許有討論，只有下達命令以及被恐嚇不遵守就處分或開除，以兩次大法官同意權行使為例，黨團會議也是毫無討論，直接下達命令，大家一頭霧水認為不宜，柯建銘也是一樣威脅跑票者開除。她質問，這就是這1年半來的問題，總召直接下達命令，不管命令有沒有欺上瞞下或假傳聖旨，但不就是因會議沒收討論，才讓握有權力的人恣意妄為嗎？民進黨黨團還要這樣繼續運作下去，讓黨團會議徒具形式、喪失民主的討論嗎？「繼郭國文之後，林淑芬也在臉書發難了」，謝寒冰今天在臉書發文表示，柯建銘現在被控假傳聖旨、欺上瞞下，整個敗局就是他一個人弄出來的，「看來這就是陳新甲碰上了崇禎，老柯這個鍋不背不行了」。不少網友也在謝寒冰的貼文留言表示，「樹倒眾人推」、「萊爾校長輕信老柯，不敗才怪」、「老柯要替主子背鍋了」、「老柯一個人有這麼大的權力嗎」。看更多相關新聞認了飆罵髒話 郭國文轟柯建銘：假傳聖旨又忽視他人意見黨團會議激辯郭國文指假傳聖旨 柯建銘否認林淑芬質疑柯建銘領導風格 砲轟黨團討論遭沒收變「一言堂」再逼宮老柯？段宜康：只要捨得就不必找理由民進黨726失血拖到823才檢討 黃暐瀚批延遲就醫準備不足,中性
不怕被川普出賣　李在明自認「很懂川普」,https://tw.news.yahoo.com/%E4%B8%8D%E6%80%95%E8%A2%AB%E5%B7%9D%E6%99%AE%E5%87%BA%E8%B3%A3-%E6%9D%8E%E5%9C%A8%E6%98%8E%E8%87%AA%E8%AA%8D-%E5%BE%88%E6%87%82%E5%B7%9D%E6%99%AE-072925375.html,中廣新聞網,2025/08/26 15:29,南韓總統李在明與美國總統川普會談前，李在明幕僚擔心李在明會被川普「出賣」。不過李在明則表示，他熟讀川普著作，「非常瞭解川普」。川普25日在白宮與南韓總統李在明會面，李在明會後表示，他的幕僚在會前很擔心，李在明會碰上烏克蘭總統澤倫斯基的狀況，不過李在明說，他知道川普是個什麼樣的人，因為他熟讀了川普所寫的「交易的藝術」。川普25日與李在明見面，川普指出，南韓計畫協助美國建立造船廠，重建美國的造船能力。川普也表示，美國將向南韓購買船隻，南韓也會到美國，利用美國的勞力來造船。川普同時指出，南韓預計將大規模採購美國的軍事裝備。川普在會後表示，美韓雙方這次達成了一個「非常好的協議」，雖然南韓方面還存有疑慮，但美國的立場堅定。川普說，美韓之間的協議，將會是目前規模最大的協議之一。,中性
非常適合台灣！ 葉宗洸稱小型反應爐：絕不會爐心融毀,https://tw.news.yahoo.com/%E9%9D%9E%E5%B8%B8%E9%81%A9%E5%90%88%E5%8F%B0%E7%81%A3-%E8%91%89%E5%AE%97%E6%B4%B8%E7%A8%B1%E5%B0%8F%E5%9E%8B%E5%8F%8D%E6%87%89%E7%88%90-%E7%B5%95%E4%B8%8D%E6%9C%83%E7%88%90%E5%BF%83%E8%9E%8D%E6%AF%80-072900431.html,東森財經,2025/08/26 15:29,823核三廠重啟公投未通過，但僅差65萬餘票就能達到25%過關門檻，引發政府重新檢視能源政策，總統賴清德更表態「不會排除先進核能的可能」，對此清大原科院院長葉宗洸日前表示，他認為「小型模組化反應器」（SMR）相較台灣現有核能電廠，由於不會有爐心融毀的本質性安全，因此非常適合台灣。葉宗洸在《POP撞新聞》節目接受資深媒體人黃暐瀚採訪，他認為「小型模組化反應器」（SMR）非常適合台灣，理由是SMR本質性安全，可以用空氣冷卻不怕爐心熔毀，產生的核廢料還只有核三廠的25%，更換燃料棒週期也更長（核三18個月，SMR換一次可用5~8年），包括廠區佔地、周邊成本都較低，如果未來供電大量引進SMR，役可提升高耗電產業來台投資的說服力。根據葉宗洸說明，SMR功率大多設定在300MW的裝置容量，設計是根據熱流和爐心物理的分析，300MW的裝置容量一旦遇到喪失冷卻水的事故，仍可透過空氣進行自然冷卻，因此絕不會出現爐心融毀的現象，此外比SMR更小的「微型反應器」（MMR）就是一台卡車大小，可以車載移動使用或部署在社區，功率約為20MW以下，兩者都是本質性的安全，也符合總統賴清德提出的技術安全原則。葉宗洸指出，SMR和MMR的核廢料產出，大約與傳統大型反應器等量，而快滋生反應爐使用的是鈾238，而非一般使用的鈾235，因此對於核廢料的減量更直接，產出核廢約只有傳統電廠的25%，也符合賴清德減降核廢料的原則，因此非常適合台灣。他還透露對2030年SMR商轉抱持期待，因為包含奇異公司、西屋公司等皆表示SMR可在2028年完成測試，預計商轉時間最快2030年，考量需要測試時間，預期台灣可能需要再等1~2年，2032年是最有可能使用的時間，那麼未來台灣針對科學園區或是重要的廠區，可以直接配置SMR自行發電，也不用擔心台電供電過程出現故障，因此SMR可以視為台灣發展半導體科技跟AI的用電選項。葉宗洸提到，美國也希望台灣盡量購買SMR，再者台灣有半導體等高耗能高科技產業，如果購買SMR，科技業將可根據廠區的用電量大小自行裝設SMR或MMR，從西屋公司目前設計來看，MMR每8年才需進行一次燃料裝填，意味著每次能連續運轉8年，這也更符合一般企業的要求。（封面圖／翻攝POP撞新聞）更多東森財經新聞報導21歲男2年無照22次「40萬罰單都不理」 土地被查封急繳清川普高喊「手上有王牌」只是不想打 一出手就會摧毀中國涉房貸詐欺！ 川普開除聯準會理事 庫克回應了,中性
非常適合台灣！ 葉宗洸稱小型反應爐：絕不會爐心融毀,https://tw.news.yahoo.com/%E9%9D%9E%E5%B8%B8%E9%81%A9%E5%90%88%E5%8F%B0%E7%81%A3-%E8%91%89%E5%AE%97%E6%B4%B8%E7%A8%B1%E5%B0%8F%E5%9E%8B%E5%8F%8D%E6%87%89%E7%88%90-%E7%B5%95%E4%B8%8D%E6%9C%83%E7%88%90%E5%BF%83%E8%9E%8D%E6%AF%80-072900187.html,東森財經,2025/08/26 15:29,823核三廠重啟公投未通過，但僅差65萬餘票就能達到25%過關門檻，引發政府重新檢視能源政策，總統賴清德更表態「不會排除先進核能的可能」，對此清大原科院院長葉宗洸日前表示，他認為「小型模組化反應器」（SMR）相較台灣現有核能電廠，由於不會有爐心融毀的本質性安全，因此非常適合台灣。葉宗洸在《POP撞新聞》節目接受資深媒體人黃暐瀚採訪，他認為「小型模組化反應器」（SMR）非常適合台灣，理由是SMR本質性安全，可以用空氣冷卻不怕爐心熔毀，產生的核廢料還只有核三廠的25%，更換燃料棒週期也更長（核三18個月，SMR換一次可用5~8年），包括廠區佔地、周邊成本都較低，如果未來供電大量引進SMR，役可提升高耗電產業來台投資的說服力。根據葉宗洸說明，SMR功率大多設定在300MW的裝置容量，設計是根據熱流和爐心物理的分析，300MW的裝置容量一旦遇到喪失冷卻水的事故，仍可透過空氣進行自然冷卻，因此絕不會出現爐心融毀的現象，此外比SMR更小的「微型反應器」（MMR）就是一台卡車大小，可以車載移動使用或部署在社區，功率約為20MW以下，兩者都是本質性的安全，也符合總統賴清德提出的技術安全原則。葉宗洸指出，SMR和MMR的核廢料產出，大約與傳統大型反應器等量，而快滋生反應爐使用的是鈾238，而非一般使用的鈾235，因此對於核廢料的減量更直接，產出核廢約只有傳統電廠的25%，也符合賴清德減降核廢料的原則，因此非常適合台灣。他還透露對2030年SMR商轉抱持期待，因為包含奇異公司、西屋公司等皆表示SMR可在2028年完成測試，預計商轉時間最快2030年，考量需要測試時間，預期台灣可能需要再等1~2年，2032年是最有可能使用的時間，那麼未來台灣針對科學園區或是重要的廠區，可以直接配置SMR自行發電，也不用擔心台電供電過程出現故障，因此SMR可以視為台灣發展半導體科技跟AI的用電選項。葉宗洸提到，美國也希望台灣盡量購買SMR，再者台灣有半導體等高耗能高科技產業，如果購買SMR，科技業將可根據廠區的用電量大小自行裝設SMR或MMR，從西屋公司目前設計來看，MMR每8年才需進行一次燃料裝填，意味著每次能連續運轉8年，這也更符合一般企業的要求。（封面圖／翻攝POP撞新聞）更多東森財經新聞報導21歲男2年無照22次「40萬罰單都不理」 土地被查封急繳清川普高喊「手上有王牌」只是不想打 一出手就會摧毀中國涉房貸詐欺！ 川普開除聯準會理事 庫克回應了,中性
竹縣首辦中小學客語能力提升計畫競賽  34校獲表揚,https://tw.news.yahoo.com/%E7%AB%B9%E7%B8%A3%E9%A6%96%E8%BE%A6%E4%B8%AD%E5%B0%8F%E5%AD%B8%E5%AE%A2%E8%AA%9E%E8%83%BD%E5%8A%9B%E6%8F%90%E5%8D%87%E8%A8%88%E7%95%AB%E7%AB%B6%E8%B3%BD-34%E6%A0%A1%E7%8D%B2%E8%A1%A8%E6%8F%9A-072900120.html,黃美珠,2025/08/26 15:29,新竹縣首度舉辦「113年~114年中小學客語能力提升計畫」競賽，北埔國小是最大贏家，今天獲縣長楊文科表揚。(記者黃美珠攝)〔記者黃美珠／新竹報導〕新竹縣首度舉辦「113年~114年中小學客語能力提升計畫」有34校表現傑出，今天獲縣長楊文科頒發「113年客語能力認證通過認證獎」、「113年客語能力認證報名人數比例競賽」以及「113學年第2學期本土語言(客語)修課人數比率競賽」3個獎項，肯定各級學校推動客語復振教學上的努力與成果。前述獎勵計畫根據學生總數分：大學校、中學校以及小學校3個組別，設置「客語能力認證通過獎」、「客語能力認證報名人數比率競賽」、「本土語言(客語)修課人數比率競賽」以及「進步獎」等多個獎勵項目，獎勵金總額高達800萬。這次競賽共171所學校參加，當中34校獲獎，總共抱走獎金151萬；其中北埔國小是大贏家，囊括1金2銅，獲獎8萬。另外9所同時贏得2個獎項的有：沙坑國小、員東國中、勝利國中、新星國小、新埔國中、新湖國小、照門國中、碧潭國小、以及福興國小。競爭激烈到有不少獎項是多校同列，其中 「本土語言(客語)修課人數比率競賽」就是最為激烈的，共有12校學生修課率達百分百，所以同列為金牌獎，它們分別是：照門、寶石、石光、峨眉、五龍、富興、坪林、田寮、太平、南和、以及沙坑共11所小學，另外就是照門國中入列。新竹縣首度舉辦中小學客語能力提升計畫競賽，有 34校表現傑出獲獎。(記者黃美珠攝)【看原文連結】更多自由時報報導平地熱翻玉山冰雹大爆發！ 主峰積冰5公分 步道「堆積如雪」不忍了！網路搶訂180顆棄單 鹿港蛋黃酥名店放大絕停業1年半「晶品城」重新裝潢 竹市府：業者申請回歸複合式商場綠能弊案！「小英男孩」鄭亦麟、東煒創辦人父子 聲押禁見,正向
托嬰中心人員「先用後訓」挨批 衛福部回應了,https://tw.news.yahoo.com/%E6%89%98%E5%AC%B0%E4%B8%AD%E5%BF%83%E4%BA%BA%E5%93%A1-%E5%85%88%E7%94%A8%E5%BE%8C%E8%A8%93-%E6%8C%A8%E6%89%B9-%E8%A1%9B%E7%A6%8F%E9%83%A8%E5%9B%9E%E6%87%89%E4%BA%86-072808240.html,李念庭,2025/08/26 15:28,托嬰中心人員零資格可進挨批！衛福部回應了（本報資料照片）托嬰中心、早療機構人力短缺，衛福部社家署近日預告修法，擬放寬托嬰中心、早療機構人員「先用後訓」，民團批評，讓零資格人員進入機構根本是「濫開後門」，若照顧者專業能力不足，等於把幼兒放上賭桌。衛福部社家署回應，放寬的人員仍須經專業訓練，且只限定評鑑甲等機構可進用，目前草案仍在預告階段，收集各界意見後會再統整討論。衛福部社家署7月24日預告修正「兒童及少年福利機構設置標準」、「兒童及少年福利機構專業人員資格及訓練辦法」部分條文草案。考量托嬰中心、早期療育機構人力短缺，擬開放評鑑甲等機構，可先進用「非專業人員」再補訓、取得專業資格，給予一年期限、最長可再延長一年，人數最高可達3分之1。托育及就業政策催生聯盟、彭婉如文教基金會、全國教保產業工會等民團，今早舉辦記者會，抗議衛福部放任「零資格人員」進入托嬰中心，恐釀更多虐嬰或悲劇，根本是濫開後門，若照顧者專業能力不足，等於把幼兒放上賭桌，相當不負責任。民團指出，家長選擇托嬰中心，是考量照顧專業度、環境安全，人力不足的解方不應該是取消資格門檻，濫開後門可能增加專業托育人員的勞動負擔、心理壓力，現場可能更混亂更危險，惡化兒少照顧安全，製造更多托育悲劇。衛福部指出，放寬資格的人員是指3年內已取得托育人員專業訓練課程126小時結業證書，或領有經教育主管機關核定或備查的幼托相關訓練至少20學分證明或360小時結業證書，並應於1年內取得托育人員技術士證或畢業證書。當托嬰中心因托育人員難覓、請假、留職停薪等情形出缺時，且最近一次評鑑甲等以上並報主管機關核准者，始得進用，且應提供其訓練及現場指導。衛福部強調，修法目的是為鼓勵有意願從事托育服務的人員可先進入職場，並希望在確保兒童托育服務品質下，能儘速補足第一線托育人員，讓家長可以安心送托。社家署代理署長周道君表示，目前兩個修正草案都在預告階段，本次修法預告截止日為9月25日，各界對於草案內容有修正意見皆可提出，衛福部會收集各界意見後，再進行綜合整理與討論，看是否進行調整。至於兒童托育服務法草案，目前仍在立法院審查。更多中時新聞網報導50萬網紅轉戰AV！娃娃音聲線「聽完耳朵懷孕」達人讚：勾魂攝魄大腸癌末期「被判死刑」 他做1事突好轉 醫也喊奇蹟川普、黃仁勳齊出手！台積電會很傷？謝金河見北京「1動作」嘆：台灣壓力更大了,中性
祖雄端湯滑手機釀禍「下秒女兒全灑身上」結局曝光　辣妻佳娜氣炸了,https://tw.news.yahoo.com/%E7%A5%96%E9%9B%84%E7%AB%AF%E6%B9%AF%E6%BB%91%E6%89%8B%E6%A9%9F%E9%87%80%E7%A6%8D-%E4%B8%8B%E7%A7%92%E5%A5%B3%E5%85%92%E5%85%A8%E7%81%91%E8%BA%AB%E4%B8%8A-%E7%B5%90%E5%B1%80%E6%9B%9D%E5%85%89-%E8%BE%A3%E5%A6%BB%E4%BD%B3%E5%A8%9C%E6%B0%A3%E7%82%B8%E4%BA%86-072800174.html,三立新聞網,2025/08/26 15:28,娛樂中心／蔡佩伶報導佳娜（右）透露有次祖雄（左）滑手機端湯，下秒竟灑在女兒身上。（圖／翻攝自YouTube）馬來西亞男星祖雄和烏克蘭女星佳娜結婚之後，育有一女，如今也即將迎接二寶的到來，家庭生活相當美滿，不過近日夫妻兩人一同登上節目時，佳娜卻坦言很害怕讓祖雄帶小孩，原來是祖雄有次一邊端湯，一邊滑手機，下一秒湯竟灑在女兒身上，讓她相當氣憤。佳娜近日分享跟祖雄的婚後生活，坦言對方有「愛滑手機」的毛病，透露自己不喜歡在用餐期間，見到眾人都在看手機，不說話的相處模式，所以有跟祖雄講好，用餐時間不要使用手機，不料有次祖雄滑手機就真的出了意外，佳娜提及當天祖雄邊滑手機邊將湯放到餐桌，結果女兒伸手一抓，就全灑在身上。來賓們一聽瞬間嚇壞，不過佳娜解釋因為習慣不喝熱湯，所以那碗湯已經放涼，女兒這才平安無事，但經此一事，佳娜也直呼很怕讓祖雄一個人顧女兒，祖雄聽聞則表示，很多時候她都看著女兒，但只要一秒鐘離開視線，女兒可能就會在地上，無奈表示，「很奧妙的發生在那一秒」。佳娜（右）慶幸自己不喝熱湯，這才沒造成女兒受傷。（圖／翻攝自YouTube）更多三立新聞網報導53歲大咖主持拒絕節稅...會計師驚嘆：多繳14億 出道34年零負評本土樂團主唱宣布結婚「新娘身分曝」 甜曬婚紗：愛要用一輩子實踐蔡阿嘎出賣小兒子！「三層肉溢出」舊照對比現況嚇壞：真的是同一人嗎梓梓真的脫了！寫真尺度驚人 「上空全裸趴床」火辣美尻被看光,中性
台中車禍驚見「倒插奇景」！轎車迴轉撞上女騎士…機車「倒頭栽」畫面曝,https://tw.news.yahoo.com/%E5%8F%B0%E4%B8%AD%E8%BB%8A%E7%A6%8D%E9%A9%9A%E8%A6%8B-%E5%80%92%E6%8F%92%E5%A5%87%E6%99%AF-%E8%BD%8E%E8%BB%8A%E8%BF%B4%E8%BD%89%E6%92%9E%E4%B8%8A%E5%A5%B3%E9%A8%8E%E5%A3%AB-%E6%A9%9F%E8%BB%8A-%E5%80%92%E9%A0%AD%E6%A0%BD-072800972.html,三立新聞網,2025/08/26 15:28,記者吳泊萱／台中報導台中發生離奇車禍，轎車迴轉碰撞機車，形成詭異「倒插奇景」。（圖／翻攝畫面）台中西屯區發生離奇車禍，昨日（25日）下午5時許，一名42歲田姓女子開車行經工業區一路準備迴轉至對向車道時，不慎撞上在左後方的簡姓女騎士，猛烈撞擊導致簡女當場彈飛，機車則被捲進轎車車底，形成「倒插奇景」。詭異畫面曝光，也在網路上引發熱議。台中發生離奇車禍，轎車迴轉碰撞機車，形成詭異「倒插奇景」。（圖／翻攝畫面）後車行車紀錄器拍下，前方綠色轎車行駛在內側車道，來到在路中間打算迴轉至對向車道，後方女騎士見狀趕緊往左閃避，結果被轎車撞個正著，女騎士當場彈飛倒地，轎車來不及煞車，直接輾過機車，結果機車受力直立站起，形成「倒插奇景」。台中發生離奇車禍，轎車迴轉碰撞機車，形成詭異「倒插奇景」。（圖／翻攝畫面）警方獲報到場時，機車仍以倒插姿勢卡在轎車下方，怪異畫面令人嘖嘖稱奇。警方調查事故發生於25日下午5時33分，當時田女（42歲）駕駛轎車沿工業區一路往臺灣大道方向行駛，於路中間迴轉時不慎撞上左後方的簡姓女騎士（54歲），造成簡女擦挫傷，幸好經治療無大礙，詳細肇事原因及責任歸屬仍有待後續調查釐清。更多三立新聞網報導彰化綠色隧道撞死人！「77歲追撞72歲」雙翁慘摔…1人無生命跡象傷重亡60年一次「乙巳青蛇年」！農曆7月鬼門開…4生肖財運大爆發講電話太大聲被制止！LV男惱羞狂嗆「列車長最大」…畫面曝光引熱議「警界媽寶」轉戰公務員！1年請假172天上新聞怒告主管求償…法官不准,負向
羅智強選藍黨主席提3承諾 「盧媽三子」齊聲援力挺,https://tw.news.yahoo.com/%E7%BE%85%E6%99%BA%E5%BC%B7%E9%81%B8%E8%97%8D%E9%BB%A8%E4%B8%BB%E5%B8%AD%E6%8F%903%E6%89%BF%E8%AB%BE-%E7%9B%A7%E5%AA%BD%E4%B8%89%E5%AD%90-%E9%BD%8A%E8%81%B2%E6%8F%B4%E5%8A%9B%E6%8C%BA-072752579.html,台視新聞網,2025/08/26 15:27,國民黨立委羅智強今（26）天開記者會，正式宣布參選國民黨主席，強調「無私心」，若當選絕不參選2028總統，並承諾2026年九合一選後，三個月內徵召盧秀燕出戰。至於上週六宣布要交棒的國民黨主席朱立倫回應，每一位有意願的同志都歡迎。對於盧秀燕表態不選黨主席，朱立倫則說，請盧市長再考慮。羅智強宣布參選黨主席 喊徵召盧秀燕選總統才剛挺過罷免案，羅智強不休息，強調參選黨主席「絕無私心」，將全力推動藍營整合，扮演「百分之百的King Maker」，力拱唯一的太陽盧秀燕，而自己將成為她的月亮。羅智強表示，「我決定參選中國國民黨主席，我不會參選2028年總統，我當選主席，完成縣市長選舉任務之後，在三個月內我會以黨主席的身分，徵召盧秀燕，完成徵召之後，我會辭去黨主席，然後支持盧秀燕接任」。羅智強也提出藍白合作構想，主張與民眾黨主席「定期會商」，並表示，若國民黨重返執政，他將建議新總統將「平反柯文哲」、「平反黃呂錦茹等同志」列為重要政見，並成立「政治迫害調查委員會」。羅智強宣布參選黨主席 「盧媽三子」力挺支持現場列席委員中，除在「馬政府時代」就與羅智強交情深厚的徐巧芯外，台中立委幾乎全數力挺。「盧媽三子」之一的羅廷瑋親自站台，顏寬恒、廖偉翔與黃建豪的助理也到場力挺支持。羅廷瑋表示，「他（羅智強）沒有派系包袱，更像是一位任務型的黨主席。中部地區許多從政夥伴都傳來祝福，期盼他為黨注入新氣象」。林沛祥則語重心長指出，「該選的人就該直接站出來，不要再玩眾星拱月那套。傳統政治只會讓年輕一代越來越失望。」羅智強想選主席 朱立倫：盧秀燕是眾望所歸至於國民黨現任主席朱立倫，在成功力抗罷免後，立刻宣布希望盧秀燕接棒，但盧秀燕表態不參選，朱立倫繼續喊話表示，「我想盧市長眾望所歸，每一位有意願的同志都很優秀，謝謝智強也表達他的期望，盧市長多考慮。」台北／桑輔成、張元杰 責任編輯／蔡尚晉更多台視新聞網報導郭智輝健康「亮紅燈」？傳肝部位異常 綠委心疼：勿拿身體健康做文章羅智強選黨魁政見公布！徵召盧秀燕選總統 成立委員會平反柯文哲羅智強宣布參選國民黨主席 首要目標「2028下架賴清德！」,正向
