title,url,author,time,content,sentiment_label
她是朱元璋「最長壽之女」，歷經8朝，明朝16帝她見過一半,https://tw.news.yahoo.com/%E5%A5%B9%E6%98%AF%E6%9C%B1%E5%85%83%E7%92%8B-%E6%9C%80%E9%95%B7%E5%A3%BD%E4%B9%8B%E5%A5%B3-%E6%AD%B7%E7%B6%938%E6%9C%9D-%E6%98%8E%E6%9C%9D16%E5%B8%9D%E5%A5%B9%E8%A6%8B%E9%81%8E-%E5%8D%8A-071500313.html,三立新聞網,2025/08/26 15:15,大陸中心／唐家興報導含山公主是朱元璋「最長壽之女」。（影視示意圖／翻攝自微博）在明朝歷史中，含山公主無疑是一位特別的存在。她並非妃嬪，也不是手握權柄的權臣，卻以八十二歲高齡，橫跨了整整八個朝代，見證了明朝十六位皇帝中的一半。她的一生沒有驚天動地的事蹟，卻比小說更傳奇，以低調與堅韌，成為明初歷史最沉默卻最穩固的「見證者」。出身高貴卻行事低調含山公主是朱元璋第十四女，生母韓妃，約生於洪武十三年前後。那時明朝剛剛奠基，她的身份起點極高，幾乎一出生就注定不凡。然而，與眾多皇室成員相比，她並未活在風口浪尖，而是選擇低調度日。史料中對她的記載不多，卻始終保有穩定的存在感。14歲出嫁，18歲守寡洪武二十七年（1394年），年僅14歲的含山公主被朱元璋許嫁給華陰人尹清。建文初年，尹清掌後府都督事。含山公主下嫁後，先後為尹家生養了兩子，長子尹勳，次子尹玉。只是，這場婚姻只維持了短短4年，尹清就意外身亡，18歲的含山公主成了寡婦，這是最難讓一個年輕女人承受的不幸。滿懷喪失之痛的含山公主從而開始了她漫長孤寂而又榮華不斷的人生旅程。八朝更迭中的「隱形見證者」從洪武到天順，含山公主歷經八個朝代。她未曾參與權力鬥爭，卻目睹了靖難之役、建文帝削藩、英宗被俘、景泰奪權等重大變局。許多皇子、公主、甚至權臣，在權力洪流中相繼倒下，但她始終屹立不倒。原因很簡單：她從不表態、不站隊，讓自己成為「不在清算名單」的存在。不爭寵、不干政！含山公主靠低調活過八位皇帝，成為明朝傳奇。（影視示意圖／翻攝自微博）皇室中的穩定象徵歷任皇帝更替，含山公主始終被尊稱為「公主」，生活待遇未曾降低。她既不干政，也不求名利，卻因輩分與年齡成為宮廷裡的「定海神針」。新皇登基往往仍需對她致敬，足見她在宗室中的份量。長壽與智慧的象徵天順六年，含山公主以八十二歲高齡去世，獲憲宗下詔厚葬，待遇接近皇后。這不僅是對長壽的尊重，更是對她「一生不添麻煩」的肯定。在那個權力鬥爭激烈的時代，能靠「不爭、不言、不站隊」活到最後，本身就是一種高段位的智慧。歷史留下的啟示含山公主不是史書上的主角，但她卻像一塊沉默的石碑，見證明初的動盪與更迭。她沒有建功立業，卻活得最長久、最安全，也最受尊重。她的一生告訴後人：在風雲詭譎的權力場裡，能守住分寸、懂得自處，比鋒芒畢露更為難得。更多三立新聞網報導蔣介石去世！張學良送「16字輓聯」 蔣經國看後臉色發白蔣介石早年上山算命，高僧當場道出了6個字，老蔣聽後雙腿發軟川島芳子在監獄被折磨3年才槍斃，臨終前直言：想和猴子埋一起為什麼「約克夏」越來越多人養？專家揭7大優勢 網友直呼心動,正向
曝心中黨主席2人選　陳玉珍：鄭麗文論述強、羅智強有募款能力會賣書,https://tw.news.yahoo.com/%E6%9B%9D%E5%BF%83%E4%B8%AD%E9%BB%A8%E4%B8%BB%E5%B8%AD2%E4%BA%BA%E9%81%B8-%E9%99%B3%E7%8E%89%E7%8F%8D-%E9%84%AD%E9%BA%97%E6%96%87%E8%AB%96%E8%BF%B0%E5%BC%B7-%E7%BE%85%E6%99%BA%E5%BC%B7%E6%9C%89%E5%8B%9F%E6%AC%BE%E8%83%BD%E5%8A%9B%E6%9C%83%E8%B3%A3%E6%9B%B8-071500031.html,三立新聞網,2025/08/26 15:15,記者陳思妤／台北報導陳玉珍接受媒體聯訪，談國民黨主席人選。（圖／翻攝畫面）國民黨主席將改選，但在台中市長盧秀燕宣布不參選後，黨內陷入焦慮。國民黨立委羅智強、鄭麗文都表態要參選黨主席，此外，還有早已表態要參選的孫文學校總校長張亞中以及前彰化縣長卓伯源。對此，國民黨立委陳玉珍今（26）日坦言，比較欣賞鄭麗文跟羅智強，大讚羅智強有募款能力、會賣書，而鄭麗文論述能力很強，希望兩人可以討論，一個當主席，一個當副主席或秘書長。陳玉珍今天受訪時被問到，羅智強也表態要選黨主席，還會堅持要修法讓立法院長韓國瑜可以當黨主席？陳玉珍澄清，這不是她提的，是有媒體記者問她，所以她才說要修法，而她認為不是不能修法，因為世界各國都有內閣閣員擔任政黨領袖，所以不覺得不可行，但要看韓國瑜有沒有意願，沒有說一定要修法。陳玉珍也提到，很多年輕的人包括羅智強、鄭麗文、卓伯源都出來了，很多年輕人願意出來承擔，希望國民黨越來越好，這都很正面，她並沒有在推修法，但社會有這些聲音，這是長久的制度，也是可以討論。媒體也追問，首要的黨魁人選是誰？陳玉珍先是反問，有表態的人來講，還是都算？接著又說，要尊重個人意願，有想當黨主席才可以討論，有表態的人比較重要。她說，就有表態的這幾個人來說，羅智強論述能力很強、空戰能力很強，當黨主席也要募款，「他也有募款一定能力，他會賣書…這精神也不錯」。陳玉珍說，跟鄭麗文當過同事，論述能力很強、思辨清楚，也是一個人才；張亞中當然也會思辨，理論基礎也很強；卓伯源則有縣市長經驗。她表示，都是一時之選，大家都是為國民黨好，這不是你死我活，登記前何嘗不能討論，都是承擔責任，還有空間，黨主席朱立倫也說是不是盧秀燕可以承擔。她強調，出來選都不是為了搶位子，是希望國民黨好，所以不覺得沒有討論空間。媒體再追問，所以比較支持誰？陳玉珍表示，自己也認識卓伯源，但她跟羅智強、鄭麗文有互動，跟這兩位在立法院一起共事過，鄭麗文當過黨團書記長，羅智強當過副書記長接下來也要當書記長，「這兩位我心裡會比較欣賞」。她也說，也許兩人可以互相討論，一個當主席，一個當副主席或秘書長，這都可以討論，因為不是出來搶位子，是出來承擔的，跟羅智強和鄭麗文互動比較多，覺得他們可以多討論。更多三立新聞網報導新聞幕後／盧秀燕選黨主席？藍議員意見分歧：她絕對被黨內搞死藍委拋修法讓韓國瑜兼黨魁 民進黨轟「因人設事的惡例」：把國會當私產朱立倫急要盧秀燕接棒！他8字打臉：「誰當選就誰就任」有什麼好擔心盧秀燕拒選黨主席是怕「這些事」！黃健庭曝：朱立倫不選絕對不是裝樣子,中性
高鐵彰化車站特定區樂齡健康產業園區土地標售 彰縣府辦說明會,https://tw.news.yahoo.com/%E9%AB%98%E9%90%B5%E5%BD%B0%E5%8C%96%E8%BB%8A%E7%AB%99%E7%89%B9%E5%AE%9A%E5%8D%80%E6%A8%82%E9%BD%A1%E5%81%A5%E5%BA%B7%E7%94%A2%E6%A5%AD%E5%9C%92%E5%8D%80%E5%9C%9F%E5%9C%B0%E6%A8%99%E5%94%AE-%E5%BD%B0%E7%B8%A3%E5%BA%9C%E8%BE%A6%E8%AA%AA%E6%98%8E%E6%9C%83-071456823.html,【記者方一成、林明佑／彰化報導】,2025/08/26 15:14,縣府在彰化高鐵田中館舉辦高速鐵路彰化車站特定區樂齡健康產業園區土地標售說明會。（記者方一成攝）▲縣府在彰化高鐵田中館舉辦高速鐵路彰化車站特定區樂齡健康產業園區土地標售說明會。（記者方一成攝）彰化縣政府今（二十六）日上午在馥御花園酒店彰化高鐵田中館舉辦「高速鐵路彰化車站特定區樂齡健康產業園區土地標售說明會」，由縣長王惠美親自主持。王縣長表示，彰化目前約有二成的高齡人口，為讓長者有更舒適、更便利的生活環境，預計在田中彰化高鐵區打造養生村。本次標售的四塊土地以樂齡健康及其關聯產業為主，預計今年九月正式公告標售細節，誠摯歡迎具有永續經營願景的優質企業投入開發，打造樂齡健康產業聚落，促進南彰化銀髮經濟發展及在地青年就業機會，照顧更多長輩，讓地方及企業共好共榮、邁向雙贏的局面。王縣長表示，田中好山好水，其中高鐵特區相當適合發展「養生村」。首先田中是「米倉」，放眼望去皆是翠綠的稻田與阡陌，空氣好、環境佳；另外交通非常便利，孩子探望父母，搭乘高鐵前來，出站就到養生村；田中附近也有許多登山步道及美景，如十八彎古道、中央嶺步道、清水岩、鼓山寺等，此處也是舉行馬拉松的重鎮，都是適合養生的因素。王縣長表示，近年來縣府衛生局及社會處積極推動長照政策，規劃布建五十二處長照據點，已完工四十一案，更首創全國「老幼共融」的長照衛福大樓計十八案，照顧0到一00歲的鄉親，打造彰化成為友善幸福城市。縣府地政處表示，高速鐵路彰化車站特定區以區段徵收辦理整體開發，擁有街廓完整、道路筆直、公共設施完備等優勢，區內更有八堡圳流經，展現田園城市的自然風貌。縣府將區段徵收配餘地規劃為四處基地，辦理公開標售。基地一指定開發「樂齡建康住宿設施」及「醫療服務設施」等項目；基地二應優先開發「醫療保健及社會工作服務業」、「藝術、娛樂及休閒服務業(排除博弈業)」等產業；為充實園區整體生活機能，基地三應優先開發「批發及零售業」、「住宿及餐飲業」等產業；另考量園區產業物流運輸之需求，基地四則優先開發「運輸及倉儲業」產業。本案採投資計畫書納入審查制度，投標廠商須依照縣府指定開發項目或優先開發產業項目，提出完整的整體開發投資計畫，經審查通過後，方能進入價格標階段後完成決標。此次標售評分重點包括，團隊組織及實績、營運計畫、興建計畫、對彰化縣承諾事項、對地方產業經濟發展貢獻等指標，期盼吸引具永續經營願景的企業參與，與縣府攜手合作、共同打造優質的樂齡健康產業園區。人口高齡化已經是全球無法避免的趨勢，彰化地理位置優越、交通便捷、氣候宜人，期望善用高速鐵路彰化車站特定區便利交通優勢與田園城市的自然環境，導入樂齡健康出租住宅、醫療設施等多元服務功能，打造兼具療養與生活品質的樂齡健康新生活圈，提供退休族群舒適宜居選擇。也可整合相關產業鏈，建構完整的樂齡健康產業聚落，預期可有效帶動相關產業群聚效應與地方經濟轉型升級，為彰化縣創造新的成長動能，實踐高齡友善幸福城市的願景。誠摯歡迎優質企業踴躍遞件參與投標，共同投資彰化，攜手開創彰化樂齡經濟的嶄新未來。,中性
挨罵「去死」不忍了！　曹興誠怒回：我幹嘛死？搬離信義區就好,https://tw.news.yahoo.com/%E6%8C%A8%E7%BD%B5-%E5%8E%BB%E6%AD%BB-%E4%B8%8D%E5%BF%8D%E4%BA%86-%E6%9B%B9%E8%88%88%E8%AA%A0%E6%80%92%E5%9B%9E-%E6%88%91%E5%B9%B9%E5%98%9B%E6%AD%BB-071431914.html,民視新聞網,2025/08/26 15:14,即時中心／高睿鴻報導雖然「全國大罷免運動」喧騰一時、更於前兩階段連署氣勢如虹，將國民黨31立委及新竹市長高虹安，全數送入3階投票；但726及823兩波開票的結果卻顯示，罷免方遭逢大敗，前述32人通通保住職位。因此，罷免團體未來何去何從、是否將重振旗鼓，引發外界關注。但罷團精神指標、聯電創辦人曹興誠，似乎仍對罷免失敗結果相當失望，甚至向節目主持人鄭弘儀表示，打算搬離國民黨立委徐巧芯所在的北市信義區。大罷免失敗後，民進黨內掀起檢討聲浪，除了內閣將大改組，國會黨團幹事長吳思瑤、書記長陳培瑜等人，也紛紛宣布不再續任。對此，鄭弘儀在節目上向曹興誠詢問說，此舉是否意在「逼宮」黨團總召柯建銘？後者該下台負責嗎？曹興誠聽後，立刻回應說，不太願意評論民進黨內部事務，除了綠營自己人才濟濟、可以自尋解決方法；更重要的是，若他評論民進黨事務，國民黨人又將見縫插針、宣稱綠營出現內鬨。他接著直言說：「像徐巧芯這個壞蛋，她一定會說，大家趕快來看綠營內鬨！我不要給她這種機會！民進黨的事情自己解決，接下來該幹什麼，綠營自有判斷」。但另一方面，由於曹興誠曾於選前宣稱，若徐巧芯無法被罷、繼續連任，自己就活不下去；因此，鄭弘儀也馬上抓準機會，笑著問說：「那你現在有什麼話，想和徐巧芯說嗎？」。曹興誠則回應說：「不用啦！他們在那邊說我應該去死，我幹嘛死？我搬離信義區就好了，離開她的選區，那選區我不待了，竟然支持這種人！那我就換個區住」。語畢，鄭弘儀略顯驚訝地追問，是真的要搬嗎？想搬去哪？曹興誠則對此回應，還在規劃何時要搬，有人建議他搬到中南部，自己也覺得可以考慮；反正就是不要繼續待信義區，「奇摩賣（台語，心情差）」了。快新聞／挨罵「去死」不忍了！ 曹興誠怒回：我幹嘛死？搬離信義區就好罷團精神領袖曹興誠。（圖／民視新聞資料照）至於為何仇恨值不低的徐巧芯、以及其他藍委，這次通通都能過關？曹興誠認為，這是因為國民黨確實「傾全黨之力」反罷，看看他們的造勢場，所有黨公職全投入；相反地，罷免方只有這些罷團上陣，游擊隊對抗正規軍，怎可能贏，他續指，國民黨打成藍綠對決、全力拚下去，所以對「游擊隊」形式的罷團來說，這樣的成就已經不得了了。曹強調，罷團很多成員不僅很多都是沒搞過政治、甚至也未曾參與選戰規劃。至於民進黨方面，曹興誠則表示，也許綠營本身有自己的選舉規劃，主要是為了2026、2028年選舉進行盤算；而公民團體搞出這次大罷免，可能是在黨的意料之外，本來並沒有在規劃中。因此他認為，民進黨一開始的態度較傾向於「罷免隨便你們搞，不要騷擾我就好了」，覺得只要不介入，就不必承擔責任；事後雖逐漸投入，但有些為時已晚。話雖如此，曹興誠仍強調，對於罷團而言，「我們並沒有輸，而是做得很成功」。他強調，至少反共意識被拉起來了、讓老共知道，「台灣人不是像你想像的那麼好搞的」，以為買通一些國民黨立委、叫去中國摸摸頭，我們就會把台灣送給共產黨。「這是不可能的！」，他說。曹興誠最後也指出，藉由這次大罷免，我們也可看出，很多人的公民教育應該要再加強。他直言說：「現在很多人就是就是搞不清楚，國民黨在講民主真的很可笑，他們想要統一，但統一就是反民主的，讓中共來台灣殺人、搶錢，你怎麼認為這是民主？很可笑，不要臉！」。原文出處：快新聞／挨罵「去死」不忍了！ 曹興誠怒回：我幹嘛死？搬離信義區就好更多民視新聞報導川普脫口「手中握有1王牌」不想打！一出手「足以毀滅中國」秒GG核三重啟公投金門逾9成同意 陳玉珍鬆口了：核廢料可放「這地」遭郭國文嗆「假傳聖旨」！柯建銘1句話反擊了,負向
類鼻疽1死！50多歲男三度就醫「腳有傷口」,https://tw.news.yahoo.com/%E9%A1%9E%E9%BC%BB%E7%96%BD1%E6%AD%BB-50%E5%A4%9A%E6%AD%B2%E7%94%B7%E4%B8%89%E5%BA%A6%E5%B0%B1%E9%86%AB-%E8%85%B3%E6%9C%89%E5%82%B7%E5%8F%A3-071431140.html,記者張乃文／台北報導,2025/08/26 15:14,▲類鼻疽本土病例增1例死亡個案為50多歲男性，有多重慢性病史。（圖／記者張乃文攝）[NOWnews今日新聞] 疾管署今（26）日公布國內上週新增9例類鼻疽本土病例，其中1例死亡，其中1例居住於北部；另外8例居住南部，年齡介於40多歲至90多歲，多具糖尿病、高血壓、慢性腎臟病等慢性病史。死亡個案為一名50多歲男性，因為多重慢性病史，出現腹瀉就醫，後續呼吸衰竭不幸死亡。疾管署防疫醫師林詠青說，一例50多歲男性因有多重慢性病史，個案在8月中出現咳嗽症狀，到了8月下旬除了咳嗽，還出現流鼻水、腹瀉等症狀。林詠青提到，個案兩度至診所就醫，診斷為一般感冒，但因為第二次至診所就醫隔天，出現發燒、呼吸困難，前往急診就醫，發現有血氧偏低等情況。林詠青說明，個案抽血後，有白血球發炎指數上升等情形，且有肺炎合併呼吸衰竭，醫師給予插管及抗生素治療，但肺炎症狀仍持續惡化，到急診隔天不幸過世，為肺炎合併急性呼吸衰竭；透過血液培養檢出類鼻疽致病菌。林詠青表示，經疫情調查發現，個案腳部有傷口，但不太確定有無汙水、汙泥接觸史。其他個案多因發燒、頭痛、咳嗽、呼吸喘等症狀就醫；另有2名個案長期使用地下水，有4名個案有污水污泥接觸史。目前8名個案均仍住院治療中，其中4名收治於加護病房，同住接觸者皆無疑似症狀。疾管署指出，今(2025)年累計50例類鼻疽本土病例(含5例死亡)，為歷年同期第3高，低於2024年(77例)及2005年(61例)，以65歲以上(31例)和50-64歲(16例)為主要年齡層，分布縣市以高雄市(38例)為多，其次為台中市(7例)、台南市(3例)、屏東縣(1例)、宜蘭縣(1例)。另今年累計34例鉤端螺旋體病本土病例，低於近5年同期，以50-64歲(14例)和25-49歲(10例)為主要年齡層，分布於13個縣市，以高雄市(6例)、台中市(6例)、新北市及台南市(各5例)為多，其餘9個縣市介於1至3例。疾管署提醒，類鼻疽之病原菌存在於受污染的土壤、水池及積水環境中，由於強風暴雨易使土壤及泥水中的病原菌暴露於地面並更易傳播，除了接觸傳播外尚可能經由食入受污染的水或吸入性感染。▲疾管署提醒，風災後清理家戶內外環境時，應戴口罩、防水手套及穿著長筒雨鞋。（圖／疾管署提供）疾管署表示，鉤端螺旋體廣泛存在於齧齒類動物，如老鼠、野生動物、寵物(狗，貓較少見)和牲畜(牛、豬、馬)等，受感染的動物可能無症狀，但其尿液大量排菌，污染水及土壤，透過皮膚或黏膜進入人體，易發生於經常接觸可能受感染動物排泄物污染的水源或屠體組織之工作者(如農民、畜牧業者等)。疾管署強調，民眾進行滅鼠工作、風災後清理家戶內外環境或因工作接觸可能受感染動物排泄物污染之水源或屠體組織，應戴口罩、防水手套及穿著長筒雨鞋，脫下裝備時記得清洗雙手，飲用水請澈底煮沸，使用自來水清洗食材及水果；此外，如有不明原因發燒等症狀應儘速就醫，並告知醫師是否有污水污泥與動物接觸史及職業暴露史，以及早診斷與治療。更多 NOWnews 今日新聞 報導研究揭睡不飽肥胖風險增！醫：3習慣不改恐影響專注力「六鵬魚油軟膠囊」驗出塑化劑超標！北市衛生局令全面下架40多歲男去西非1個月！返台確診惡性瘧 入境當天冒3症狀,中性
三大法人賣超台股138.09億元,https://tw.news.yahoo.com/%E4%B8%89%E5%A4%A7%E6%B3%95%E4%BA%BA%E8%B3%A3%E8%B6%85%E5%8F%B0%E8%82%A1138-09%E5%84%84%E5%85%83-071412504.html,The Central News Agency 中央通訊社,2025/08/26 15:14,（中央社台北26日電）台股今天漲27.72點，收在24305.1點，成交值新台幣5140.13億元。三大法人外資及陸資賣超、投信賣超、自營商買超，合計賣超138.09億元。自營商買超33.24億元，投信賣超26.25億元，外資及陸資賣超145.08億元。1140826,中性
「六鵬魚油軟膠囊」塑化劑超標！ 衛生局要求全面下架,https://tw.news.yahoo.com/%E5%85%AD%E9%B5%AC%E9%AD%9A%E6%B2%B9%E8%BB%9F%E8%86%A0%E5%9B%8A-%E5%A1%91%E5%8C%96%E5%8A%91%E8%B6%85%E6%A8%99-%E8%A1%9B%E7%94%9F%E5%B1%80%E8%A6%81%E6%B1%82%E5%85%A8%E9%9D%A2%E4%B8%8B%E6%9E%B6-071411238.html,台視新聞網,2025/08/26 15:14,有市售魚油驗出「塑化劑」超標！北市衛生局日前針對賣場、超市、藥局等處，抽驗市售膠囊錠狀食品、油脂類及嬰幼兒食品，發現其中一件「六鵬魚油軟膠囊」塑化劑超過標準10倍，已全面要求販售地點下架，並移請來源廠商所在縣市衛生局調查。北市衛生局本次共抽驗25件產品，包括10件膠囊或錠狀食品、10件油脂、5件嬰幼兒食品，檢驗9項塑化劑，其中1件膠囊食品「六鵬魚油軟膠囊」檢出6.31ppm鄰苯二甲酸二丁酯（DBP），超過指標值0.6ppm。衛生局表示，塑化劑非屬合法食品添加物，但可能來自於食品原料或加工過程中，透過塑膠材質設備、容器或包材等之游離溶出而間接污染，因此應自源頭及製程加以管理。部分塑化劑會干擾動物內分泌系統，導致生殖、發育和行為異常，長期累積可能會對健康造成影響，故衛生福利部食品藥物管理署於100年10月制定「降低食品中塑化劑含量之企業指引」，針對飲料、嬰幼兒食品、膠囊錠狀食品、油脂類、米麵製品、甜點及其他加工食品等訂有「企業監測塑化劑指標值」，提供業者自訂預防或改善產品受塑化劑污染的品質管理。目前衛生局已令販售場所下架六鵬魚油軟膠囊違規產品，並依「降低食品中塑化劑含量之企業指引」規定辦理，移請來源廠商衛生局辦理。六鵬魚油軟膠囊。圖／台北市政府提供責任編輯／陳盈真更多台視新聞網報導年菜沒吃完拿保鮮膜打包 醫：踩3地雷恐吃下毒塑膠微粒危害健康 醫曝別吃「帶殼海鮮」外食族注意！國人體內塑化劑含量「高於歐美2至7倍」,中性
日本DIY展　台灣館宣傳 (圖),https://tw.news.yahoo.com/%E6%97%A5%E6%9C%ACdiy%E5%B1%95-%E5%8F%B0%E7%81%A3%E9%A4%A8%E5%AE%A3%E5%82%B3-%E5%9C%96-071405396.html,The Central News Agency 中央通訊社,2025/08/26 15:14,「第61回JAPAN DIY HOMECENTER SHOW 2025」21日至23日在幕張展覽館舉行，是日本規模最大的業界展會，台灣館今年有38家廠商參展，在海濱幕張車站月台投放廣告宣傳。中央社記者楊明珠千葉攝 114年8月26日日本DIY展 台灣館宣傳 「第61回JAPAN DIY HOMECENTER SHOW 2025」21 日至23日在幕張展覽館舉行，是日本規模最大的業界 展會，台灣館今年有38家廠商參展，在海濱幕張車站 月台投放廣告宣傳。 中央社記者楊明珠千葉攝 114年8月26日,中性
王珮伃世大運奪銀　周春米頒發獎勵金 (圖),https://tw.news.yahoo.com/%E7%8E%8B%E7%8F%AE%E4%BC%83%E4%B8%96%E5%A4%A7%E9%81%8B%E5%A5%AA%E9%8A%80-%E5%91%A8%E6%98%A5%E7%B1%B3%E9%A0%92%E7%99%BC%E7%8D%8E%E5%8B%B5%E9%87%91-%E5%9C%96-071403334.html,The Central News Agency 中央通訊社,2025/08/26 15:14,有「羽球小可愛」之稱的台灣好手王珮伃（右）出戰2025世界大學運動會混合團體賽勇奪銀牌，屏東縣長周春米（左）26日接見，並頒發獎勵金。中央社記者李卉婷攝 114年8月26日王珮伃世大運奪銀 周春米頒發獎勵金 有「羽球小可愛」之稱的台灣好手王珮伃（右）出戰 2025世界大學運動會混合團體賽勇奪銀牌，屏東縣長 周春米（左）26日接見，並頒發獎勵金。 中央社記者李卉婷攝 114年8月26日,中性
